title,description,category,target_points,current_points,status,deadline
"Website Redesign","Complete redesign of company website with modern UI/UX",Business,800,200,active,2024-04-15
"Mobile App Development","Build iOS and Android app for customer engagement",Technology,1200,0,planning,2024-08-30
"Marketing Campaign Q2","Launch comprehensive marketing campaign for Q2",Marketing,600,150,active,2024-06-30
"Team Training Program","Implement comprehensive training program for all employees",HR,400,0,planning,2024-05-31
"Product Launch","Launch new product line with full marketing support",Business,1000,0,planning,2024-09-15
