title,description,points_value,money_value,priority,estimated_time,deadline
"Research competitors","Analyze top 5 competitors and their pricing strategies",50,0,high,2 hours,2024-03-15
"Design wireframes","Create wireframes for the new mobile app",100,0,high,4 hours,2024-03-20
"Write blog post","Write 1500-word blog post about industry trends",30,0,medium,3 hours,2024-03-18
"Update website content","Update homepage content with new messaging",25,0,medium,1 hour,2024-03-12
"Schedule team meeting","Organize weekly team standup meeting",10,0,low,30 minutes,2024-03-11
"Review contracts","Review and update vendor contracts",75,0,high,2 hours,2024-03-25
"Create social media posts","Design and schedule social media content for next week",40,0,medium,2 hours,2024-03-14
"Update project documentation","Update project documentation with latest changes",35,0,low,1 hour,2024-03-16